{
  "$schema": "./schema/root.json",
  "countries": [
    {
      "id": "CZK",
      "name": "Czech Republic",
      "population": 10690000,
      "cities": [
        {
          "id": "PRG",
          "name": "Prague",
          "population": 1309000,
          "places": [
            {
              "id": "test_1",
              "name": "Test Place",
              "rooms": [
                {
                  "id": "test_1",
                  "name": "bathroom",
                  "description": "A dark room just to test",
                  "objects": ["$objects_test1", "$objects_test2"]
                }
              ]
            },
            {
              "id": "test_2",
              "name": "Test Place 2",
              "rooms": [
                {
                  "id": "test_1",
                  "name": "kitchen",
                  "description": "A dark room just to test, but again",
                  "objects": []
                }
              ]
            },
            {
              "id": "test_3",
              "name": "Test Place 3",
              "rooms": [
                {
                  "id": "test_1",
                  "name": "kitchen",
                  "description": "A dark room just to test, but again",
                  "objects": []
                }
              ]
            }
          ]
        }
      ]
    }
  ],
  "genres": [
    {
      "id": "not_blvck",
      "name": "Blackgaze",
      "compatibleWith": []
    }
  ],
  "instruments": [
    {
      "id": "guitar",
      "name": "Guitar",
      "allowsAnotherInstrument": true,
      "associatedSkill": "$skills_guitar"
    }
  ],
  "skills": [
    {
      "id": "guitar",
      "name": "Guitar",
      "category": "Music"
    }
  ],
  "objects": [
    {
      "id": "test1",
      "name": "guitar",
      "description": "A simple guitar for testing",
      "type": {
        "Instrument": "$instruments_guitar"
      }
    },
    {
      "id": "test2",
      "name": "fake guitar",
      "description": "A fake guitar to test spaces in names",
      "type": {
        "Instrument": "$instruments_guitar"
      }
    }
  ]
}
